{
  "schema_name": "harbeat.instrument_analysis",
  "schema_version": "0.1.0",
  "track_id": "track_001",
  "status": "ready",
  "duration_sec": 4.0,
  "timeline_fingerprint": "aaaaaaaaaaaaaaaaaaaaaaaaaaaaaaaaaaaaaaaaaaaaaaaaaaaaaaaaaaaaaaaa",
  "taxonomy_version": "instrument_taxonomy@0.1.0",
  "models": {
    "adtof": {"model_id": "adtof-pytorch", "model_version": "upstream", "deployment_status": "shadow", "availability": "available", "checkpoint_sha256": "bbbbbbbbbbbbbbbbbbbbbbbbbbbbbbbbbbbbbbbbbbbbbbbbbbbbbbbbbbbbbbbb", "source_revision": "cccccccccccccccccccccccccccccccccccccccc", "license_status": "review_required", "error": null},
    "panns": {"model_id": "panns-cnn14", "model_version": "upstream", "deployment_status": "shadow", "availability": "available", "checkpoint_sha256": "dddddddddddddddddddddddddddddddddddddddddddddddddddddddddddddddd", "source_revision": "eeeeeeeeeeeeeeeeeeeeeeeeeeeeeeeeeeeeeeee", "license_status": "review_required", "error": null}
  },
  "bars": [{
    "bar_index": 0,
    "start_sec": 0.0,
    "end_sec": 4.0,
    "drum_events": [{"time_sec": 1.0, "drum_class": "kick", "confidence": 0.9, "bar_index": 0, "beat_index_in_bar": 1, "beat_position": 2.0}],
    "drum_summary": {"event_counts": {"kick": 1, "snare": 0, "hihat": 0, "tom": 0, "cymbal": 0}, "density_per_sec": 0.25},
    "instrument_probabilities": [{"instrument_class": "bass", "mean_probability": 0.5, "max_probability": 0.8, "active_coverage": 0.5}],
    "validation_status": "unreviewed"
  }],
  "warnings": []
}
